URL,Version,Status,OIDs,Name,Title,Descriptino,Used
http://dicom.nema.org/resources/ontology/DCM,01,active,"1.2.840.10008.2.16.4",DICOM Controlled Terminology Definitions,null,"DICOM Code Definitions (Coding Scheme Designator ""DCM"" Coding Scheme Version ""01"")","ValueSet/audit-event-type"
http://terminology.hl7.org/CodeSystem/audit-event-type,1.0.0,active,"2.16.840.1.113883.4.642.1.1136",AuditEventID,Audit Event ID,"Event Types for Audit Events - defined by DICOM with some FHIR specific additions.","ValueSet/audit-event-type"
http://terminology.hl7.org/CodeSystem/iso-21089-lifecycle,1.0.0,active,,Iso_21089_2017_Health_Record_Lifecycle_Events,ISO 21089 2017 Health Record Lifecycle Events,"Attached is vocabulary for the 27 record lifecycle events, as per ISO TS 21089-2017, Health Informatics - Trusted End-to-End Information Flows, Section 3, Terms and Definitions (2017, at ISO Central Secretariat, passed ballot and ready for publication).  This will also be included in the FHIR EHR Record Lifecycle Event Implementation Guide, balloted and (to be) published with FHIR STU-3.","ValueSet/audit-event-type"
urn:oid:2.16.756.5.30.1.127.3.10.14,2.0.10,active,"2.16.756.5.30.1.127.3.10.14",ChEhealthCodesystemAgentRole,ch-ehealth-codesystem-agentRole,"Role codes as per Annex 5 EPRO-FDHA, CH:ATC, version July 2019","ValueSet/EprParticipant"
urn:oid:2.16.756.5.30.1.127.3.10.5,2.0.10,active,"2.16.756.5.30.1.127.3.10.5",ChEhealthCodesystemPurposeOfUse,ch-ehealth-codesystem-purposeOfUse,"Purpose Of Use as per Annex 5 EPRO-FDHA, Extension 1.","ValueSet/EprPurposeOfUse"
urn:oid:2.16.756.5.30.1.127.3.10.6,2.0.10,active,"2.16.756.5.30.1.127.3.10.6",ChEhealthCodesystemRole,ch-ehealth-codesystem-role,"Role codes as per Annex 5 EPRO-FDHA, version July 2019","ValueSet/EprParticipant"
urn:oid:2.16.756.5.30.1.127.3.10.7,2.0.10,active,"2.16.756.5.30.1.127.3.10.7",ChEhealthCodesystemAtc,ch-ehealth-codesystem-atc,"Audit Trail Consumption Event Types for CH:ATC","ValueSet/DocumentAuditEventType,ValueSet/AccessAuditTrailEventType,ValueSet/HpdAuditEventType,ValueSet/PolicyAuditEventType"
