URL,Version,Status,OIDs,Name,Title,Description,Used
http://snomed.info/sct,null,active,"2.16.840.1.113883.6.96",SNOMED_CT,SNOMED CT (all versions),"SNOMED CT is the most comprehensive and precise clinical health terminology product in the world, owned and distributed around the world by The International Health Terminology Standards Development Organisation (IHTSDO).","ValueSet/CHAllergyIntoleranceReactionManifestationValueSet,ValueSet/condition-stage,ValueSet/treatmentreason,ValueSet/encounter-reason,ValueSet/participant-role,ValueSet/additional-instruction-codes,ValueSet/approach-site-codes,ValueSet/ch-vacd-recommendation-categories-vs,ValueSet/ch-vacd-vaccines-snomedct-vs,ValueSet/DocumentEntry.typeCode,ValueSet/medication-codes,ValueSet/body-site,ValueSet/manifestation-or-symptom,ValueSet/procedure-code,ValueSet/ch-vacd-vaccines-vs,ValueSet/HCProfessional.hcProfession,ValueSet/ActivePharmaceuticalIngredient,ValueSet/reason-medication-not-given-codes,ValueSet/ch-vacd-targetdiseasesandillnessesundergoneforimmunization-vs,ValueSet/CHAllergyIntoleranceConditionValueSet,ValueSet/reason-medication-status-codes,ValueSet/medication-as-needed-reason,ValueSet/CHAllergyIntoleranceReactionSubstanceValueSet,ValueSet/performer-role,ValueSet/immunization-reason,ValueSet/DocumentEntry.healthcareFacilityTypeCode,ValueSet/CHAllergyIntoleranceValueSet,ValueSet/route-codes,ValueSet/procedure-reason,ValueSet/DocumentEntry.classCode,ValueSet/UnitCode,ValueSet/condition-code,ValueSet/DocumentEntry.confidentialityCode,ValueSet/condition-stage-type,ValueSet/immunization-status-reason,ValueSet/ch-vacd-ch-vaccination-plan-immunizations-vs,ValueSet/servicerequest-orderdetail,ValueSet/DocumentEntry.practiceSettingCode,ValueSet/condition-severity"
http://standardterms.edqm.eu,5 March 2019,active,"0.4.0.127.0.16.1.1.2.1",EDQM_Standard_Terms,EDQM Standard Terms,"Standard terms published by the European Directorate for the Quality of Medicines & HealthCare (EDQM) for pharmaceutical dose forms, routes and methods of administration, containers, closures, administration devices and units of presentation.","ValueSet/ch-vacd-route-of-administration-vs"
http://terminology.hl7.org/CodeSystem/FDI-surface,1.0.0,draft,"2.16.840.1.113883.4.642.1.1154",SurfaceCodes,Surface Codes,"This value set includes a smattering of FDI tooth surface codes.","ValueSet/surface"
http://terminology.hl7.org/CodeSystem/allergyintolerance-clinical,1.0.1,active,"2.16.840.1.113883.4.642.1.1373",AllergyIntoleranceClinicalStatusCodes,AllergyIntolerance Clinical Status Codes,"Preferred value set for AllergyIntolerance Clinical Status.","ValueSet/allergyintolerance-clinical"
http://terminology.hl7.org/CodeSystem/allergyintolerance-verification,1.0.1,active,"2.16.840.1.113883.4.642.1.1371",AllergyIntoleranceVerificationStatus,AllergyIntolerance Verification Status,"The verification status to support or decline the clinical status of the allergy or intolerance.","ValueSet/allergyintolerance-verification"
http://terminology.hl7.org/CodeSystem/claim-exception,1.0.1,active,"2.16.840.1.113883.4.642.1.1162",ExceptionCodes,Exception Codes,"This value set includes sample Exception codes.","ValueSet/claim-exception"
http://terminology.hl7.org/CodeSystem/claimcareteamrole,1.0.1,active,"2.16.840.1.113883.4.642.1.1165",ClaimCareTeamRoleCodes,Claim Care Team Role Codes,"Claim roles of the care team members providing products and services.","ValueSet/claim-careteamrole"
http://terminology.hl7.org/CodeSystem/claiminformationcategory,1.0.1,active,"2.16.840.1.113883.4.642.1.1163",ClaimInformationCategoryCodes,Claim Information Category Codes,"This value set includes sample Information Category codes.","ValueSet/claim-informationcategory"
http://terminology.hl7.org/CodeSystem/condition-category,1.0.1,active,"2.16.840.1.113883.4.642.1.1073",ConditionCategoryCodes,Condition Category Codes,"Preferred value set for Condition Categories.","ValueSet/condition-category"
http://terminology.hl7.org/CodeSystem/condition-clinical,3.0.0,active,"2.16.840.1.113883.4.642.1.1074",ConditionClinicalStatusCodes,Condition Clinical Status Codes,"Preferred value set for Condition Clinical Status.","ValueSet/condition-clinical"
http://terminology.hl7.org/CodeSystem/condition-ver-status,2.0.1,active,"2.16.840.1.113883.4.642.1.1075",ConditionVerificationStatus,ConditionVerificationStatus,"The verification status to support or decline the clinical status of the condition or diagnosis.","ValueSet/condition-ver-status"
http://terminology.hl7.org/CodeSystem/consentaction,1.0.1,active,"2.16.840.1.113883.4.642.1.1227",ConsentActionCodes,Consent Action Codes,"This value set includes sample Consent Action codes.","ValueSet/consent-action"
http://terminology.hl7.org/CodeSystem/consentcategorycodes,1.0.1,active,"2.16.840.1.113883.4.642.1.1226",ConsentCategoryCodes,Consent Category Codes,"This value set includes sample Consent Directive Type codes, including several consent directive related LOINC codes; HL7 VALUE SET: ActConsentType(2.16.840.1.113883.1.11.19897); examples of US realm consent directive legal descriptions and references to online and/or downloadable forms such as the SSA-827 Authorization to Disclose Information to the Social Security Administration; and other anticipated consent directives related to participation in a clinical trial, medical procedures, reproductive procedures; health care directive (Living Will); advance directive, do not resuscitate (DNR); Physician Orders for Life-Sustaining Treatment (POLST)","ValueSet/consent-category"
http://terminology.hl7.org/CodeSystem/consentpolicycodes,3.0.1,active,"2.16.840.1.113883.4.642.1.1229",ConsentPolicyRuleCodes,Consent PolicyRule Codes,"This value set includes sample Regulatory consent policy types from the US and other regions.","ValueSet/consent-policy"
http://terminology.hl7.org/CodeSystem/consentscope,2.0.1,active,"2.16.840.1.113883.4.642.1.1228",ConsentScopeCodes,Consent Scope Codes,"This value set includes the four Consent scope codes.","ValueSet/consent-scope"
http://terminology.hl7.org/CodeSystem/contactentity-type,1.0.0,draft,"2.16.840.1.113883.4.642.1.1129",ContactEntityType,Contact entity type,"This example value set defines a set of codes that can be used to indicate the purpose for which you would contact a contact party.","ValueSet/contactentity-type"
http://terminology.hl7.org/CodeSystem/contractsignertypecodes,1.0.1,active,"2.16.840.1.113883.4.642.1.1201",ContractSignerTypeCodes,Contract Signer Type Codes,"This value set includes sample Contract Signer Type codes.","ValueSet/security-role-type"
http://terminology.hl7.org/CodeSystem/coverage-copay-type,1.0.1,active,"2.16.840.1.113883.4.642.1.1149",CoverageCopayTypeCodes,Coverage Copay Type Codes,"This value set includes sample Coverage Copayment Type codes.","ValueSet/coverage-copay-type"
http://terminology.hl7.org/CodeSystem/diagnosis-role,1.1.1,active,"2.16.840.1.113883.4.642.1.1054",DiagnosisRole,Diagnosis Role,"This value set defines a set of codes that can be used to express the role of a diagnosis on the Encounter or EpisodeOfCare record.","ValueSet/diagnosis-role"
http://terminology.hl7.org/CodeSystem/diet,1.0.1,active,"2.16.840.1.113883.4.642.1.1091",Diet,Diet,"This value set defines a set of codes that can be used to indicate dietary preferences or restrictions a patient may have.","ValueSet/encounter-diet"
http://terminology.hl7.org/CodeSystem/dose-rate-type,1.0.0,draft,"2.16.840.1.113883.4.642.1.1069",DoseAndRateType,DoseAndRateType,"The kind of dose or rate specified.","ValueSet/dose-rate-type"
http://terminology.hl7.org/CodeSystem/encounter-special-arrangements,1.0.1,active,"2.16.840.1.113883.4.642.1.1090",SpecialArrangements,Special arrangements,"This value set defines a set of codes that can be used to indicate the kinds of special arrangements in place for a patients visit.","ValueSet/encounter-special-arrangements"
http://terminology.hl7.org/CodeSystem/encounter-type,1.0.1,active,"2.16.840.1.113883.4.642.1.1088",EncounterType,Encounter type,"This example value set defines a set of codes that can be used to indicate the type of encounter: a specific code indicating type of service provided.","ValueSet/encounter-type"
http://terminology.hl7.org/CodeSystem/ex-USCLS,1.0.0,draft,"2.16.840.1.113883.4.642.1.1153",USCLSCodes,USCLS Codes,"This value set includes a smattering of USCLS codes.","ValueSet/service-uscls"
http://terminology.hl7.org/CodeSystem/ex-benefitcategory,1.0.1,active,"2.16.840.1.113883.4.642.1.1175",BenefitCategoryCodes,Benefit Category Codes,"This value set includes examples of Benefit Category codes.","ValueSet/ex-benefitcategory"
http://terminology.hl7.org/CodeSystem/ex-claimsubtype,1.0.1,active,"2.16.840.1.113883.4.642.1.1158",ExampleClaimSubTypeCodes,Example Claim SubType Codes,"This value set includes sample Claim SubType codes which are used to distinguish the claim types for example within type institutional there may be subtypes for emergency services, bed stay and transportation.","ValueSet/claim-subtype"
http://terminology.hl7.org/CodeSystem/ex-coverage-financial-exception,1.0.1,active,"2.16.840.1.113883.4.642.1.1329",ExampleCoverageFinancialExceptionCodes,Example Coverage Financial Exception Codes,"This value set includes Example Coverage Financial Exception Codes.","ValueSet/coverage-financial-exception"
http://terminology.hl7.org/CodeSystem/ex-diagnosis-on-admission,1.0.1,active,"2.16.840.1.113883.4.642.1.1170",ExampleDiagnosisOnAdmissionCodes,Example Diagnosis on Admission Codes,"This value set includes example Diagnosis on Admission codes.","ValueSet/ex-diagnosis-on-admission"
http://terminology.hl7.org/CodeSystem/ex-diagnosisrelatedgroup,1.0.1,active,"2.16.840.1.113883.4.642.1.1166",ExampleDiagnosisRelatedGroupCodes,Example Diagnosis Related Group Codes,"This value set includes example Diagnosis Related Group codes.","ValueSet/ex-diagnosisrelatedgroup"
http://terminology.hl7.org/CodeSystem/ex-diagnosistype,1.0.1,active,"2.16.840.1.113883.4.642.1.1167",ExampleDiagnosisTypeCodes,Example Diagnosis Type Codes,"This value set includes example Diagnosis Type codes.","ValueSet/ex-diagnosistype"
http://terminology.hl7.org/CodeSystem/ex-procedure-type,1.0.1,active,"2.16.840.1.113883.4.642.1.1388",ExampleProcedureTypeCodes,Example Procedure Type Codes,"This value set includes example Procedure Type codes.","ValueSet/ex-procedure-type"
http://terminology.hl7.org/CodeSystem/ex-programcode,1.0.1,active,"2.16.840.1.113883.4.642.1.1161",ExampleProgramReasonCodes,Example Program Reason Codes,"This value set includes sample Program Reason Span codes.","ValueSet/ex-program-code"
http://terminology.hl7.org/CodeSystem/ex-providerqualification,1.0.1,active,"2.16.840.1.113883.4.642.1.1160",ExampleProviderQualificationCodes,Example Provider Qualification Codes,"This value set includes sample Provider Qualification codes.","ValueSet/provider-qualification"
http://terminology.hl7.org/CodeSystem/ex-relatedclaimrelationship,1.0.1,active,"2.16.840.1.113883.4.642.1.1159",ExampleRelatedClaimRelationshipCodes,Example Related Claim Relationship Codes,"This value set includes sample Related Claim Relationship codes.","ValueSet/related-claim-relationship"
http://terminology.hl7.org/CodeSystem/ex-revenue-center,1.0.1,active,"2.16.840.1.113883.4.642.1.1168",ExampleRevenueCenterCodes,Example Revenue Center Codes,"This value set includes sample Revenue Center codes.","ValueSet/ex-revenue-center"
http://terminology.hl7.org/CodeSystem/ex-serviceplace,1.0.1,active,"2.16.840.1.113883.4.642.1.1157",ExampleServicePlaceCodes,Example Service Place Codes,"This value set includes a smattering of Service Place codes.","ValueSet/service-place"
http://terminology.hl7.org/CodeSystem/ex-tooth,1.0.0,draft,"2.16.840.1.113883.4.642.1.1152",OralSiteCodes,Oral Site Codes,"This value set includes a smattering of FDI oral site codes.","ValueSet/tooth"
http://terminology.hl7.org/CodeSystem/extra-security-role-type,1.0.1,active,,SecurityRoleType,Security Role Type,"This CodeSystem contains Additional FHIR-defined Security Role types not defined elsewhere","ValueSet/security-role-type"
http://terminology.hl7.org/CodeSystem/fundsreserve,1.0.1,active,"2.16.840.1.113883.4.642.1.1051",FundsReservationCodes,Funds Reservation Codes,"This value set includes sample funds reservation type codes.","ValueSet/fundsreserve"
http://terminology.hl7.org/CodeSystem/immunization-funding-source,1.0.1,active,"2.16.840.1.113883.4.642.1.1100",ImmunizationFundingSource,Immunization Funding Source,"The value set to instantiate this attribute should be drawn from a terminologically robust code system that consists of or contains concepts to support describing the source of the vaccine administered. This value set is provided as a suggestive example.","ValueSet/immunization-funding-source"
http://terminology.hl7.org/CodeSystem/immunization-origin,1.0.1,active,"2.16.840.1.113883.4.642.1.1101",ImmunizationOriginCodes,Immunization Origin Codes,"The value set to instantiate this attribute should be drawn from a terminologically robust code system that consists of or contains concepts to support describing the source of the data when the report of the immunization event is not based on information from the person, entity or organization who administered the vaccine. This value set is provided as a suggestive example.","ValueSet/immunization-origin"
http://terminology.hl7.org/CodeSystem/immunization-program-eligibility,1.0.1,active,"2.16.840.1.113883.4.642.1.1099",ImmunizationProgramEligibility,Immunization Program Eligibility,"The value set to instantiate this attribute should be drawn from a terminologically robust code system that consists of or contains concepts to support describing the patient's eligibility for a vaccination program. This value set is provided as a suggestive example.","ValueSet/immunization-program-eligibility"
http://terminology.hl7.org/CodeSystem/immunization-subpotent-reason,1.0.1,active,"2.16.840.1.113883.4.642.1.1098",ImmunizationSubpotentReason,Immunization Subpotent Reason,"The value set to instantiate this attribute should be drawn from a terminologically robust code system that consists of or contains concepts to support describing the reason why a dose is considered to be subpotent. This value set is provided as a suggestive example.","ValueSet/immunization-subpotent-reason"
http://terminology.hl7.org/CodeSystem/list-empty-reason,1.0.1,active,"2.16.840.1.113883.4.642.1.1106",ListEmptyReasons,List Empty Reasons,"General reasons for a list to be empty. Reasons are either related to a summary list (i.e. problem or medication list) or to a workflow related list (i.e. consultation list).","ValueSet/list-empty-reason"
http://terminology.hl7.org/CodeSystem/list-order,1.0.1,active,"2.16.840.1.113883.4.642.1.1107",ListOrderCodes,List Order Codes,"Base values for the order of the items in a list resource.","ValueSet/list-order"
http://terminology.hl7.org/CodeSystem/location-physical-type,2.0.1,active,"2.16.840.1.113883.4.642.1.1108",LocationType,Location type,"This example value set defines a set of codes that can be used to indicate the physical form of the Location.  This includes several 'non physical' codes which are still considered a location.","ValueSet/location-physical-type"
http://terminology.hl7.org/CodeSystem/med-admin-perform-function,1.0.1,active,"2.16.840.1.113883.4.642.1.1112",MedicationAdministrationPerformerFunctionCodes,MedicationAdministration Performer Function Codes,"MedicationAdministration Performer Function Codes","ValueSet/med-admin-perform-function"
http://terminology.hl7.org/CodeSystem/medication-admin-category,4.0.1,draft,"2.16.840.1.113883.4.642.4.1111",MedicationAdministration Category Codes,Medication administration  category  codes,"MedicationAdministration Category Codes","ValueSet/medication-admin-category"
http://terminology.hl7.org/CodeSystem/medication-admin-status,4.0.1,draft,"2.16.840.1.113883.4.642.4.1311",MedicationAdministration Status Codes,Medication administration  status  codes,"MedicationAdministration Status Codes","ValueSet/medication-admin-status"
http://terminology.hl7.org/CodeSystem/medication-statement-category,4.0.1,draft,"2.16.840.1.113883.4.642.4.1120",Medication usage category codes,Medication usage category codes,"Medication Status Codes","ValueSet/medication-statement-category"
http://terminology.hl7.org/CodeSystem/medicationdispense-performer-function,1.0.1,active,"2.16.840.1.113883.4.642.1.1319",MedicationDispensePerformerFunctionCodes,MedicationDispense Performer Function Codes,"MedicationDispense Performer Function Codes","ValueSet/medicationdispense-performer-function"
http://terminology.hl7.org/CodeSystem/medicationdispense-status,4.0.1,draft,"2.16.840.1.113883.4.642.4.1313",MedicationDispense Status Codes,Medication dispense  status  codes,"MedicationDispense Status Codes","ValueSet/medicationdispense-status"
http://terminology.hl7.org/CodeSystem/medicationrequest-category,1.0.0,draft,"2.16.840.1.113883.4.642.1.1323",MedicationRequestCategoryCodes,MedicationRequest Category Codes,"MedicationRequest Category Codes","ValueSet/medicationrequest-category"
http://terminology.hl7.org/CodeSystem/medicationrequest-course-of-therapy,1.0.1,active,"2.16.840.1.113883.4.642.1.1327",MedicationRequestCourseOfTherapyCodes,MedicationRequest Course of Therapy Codes,"MedicationRequest Course of Therapy Codes","ValueSet/medicationrequest-course-of-therapy"
http://terminology.hl7.org/CodeSystem/medicationrequest-status-reason,1.0.1,active,"2.16.840.1.113883.4.642.1.1325",MedicationRequestStatusReasonCodes,MedicationRequest Status Reason Codes,"MedicationRequest Status Reason Codes","ValueSet/medicationrequest-status-reason"
http://terminology.hl7.org/CodeSystem/missingtoothreason,1.0.1,active,"2.16.840.1.113883.4.642.1.1150",MissingToothReasonCodes,Missing Tooth Reason Codes,"This value set includes sample Missing Tooth Reason codes.","ValueSet/missing-tooth-reason"
http://terminology.hl7.org/CodeSystem/modifiers,1.0.1,active,"2.16.840.1.113883.4.642.1.1151",ModifierTypeCodes,Modifier type Codes,"This value set includes sample Modifier type codes.","ValueSet/claim-modifiers"
http://terminology.hl7.org/CodeSystem/payeetype,1.0.1,active,"2.16.840.1.113883.4.642.1.1050",ClaimPayeeTypeCodes,Payee Type Codes,"Codes indicating the type of party to be reimbursed for cost of products and services.","ValueSet/payeetype"
http://terminology.hl7.org/CodeSystem/processpriority,1.0.1,active,"2.16.840.1.113883.4.642.1.1155",ProcessPriorityCodes,Process Priority Codes,"This value set includes the financial processing priority codes.","ValueSet/process-priority"
http://terminology.hl7.org/CodeSystem/reason-medication-given,1.0.1,active,"2.16.840.1.113883.4.642.1.1110",ReasonMedicationGivenCodes,Reason Medication Given Codes,"This value set is provided as an example. The value set to instantiate this attribute should be drawn from a robust terminology code system that consists of or contains concepts to support the medication process.","ValueSet/reason-medication-given-codes"
http://terminology.hl7.org/CodeSystem/service-type,1.1.1,active,"2.16.840.1.113883.4.642.1.1145",ServiceType,Service type,"This value set defines an example set of codes of service-types.","ValueSet/service-type"
http://terminology.hl7.org/CodeSystem/subscriber-relationship,1.0.1,active,"2.16.840.1.113883.4.642.1.1386",SubscriberRelationshipCodes,SubscriberPolicyholder Relationship Codes,"This value set includes codes for the relationship between the Subscriber and the Beneficiary (insured/covered party/patient).","ValueSet/subscriber-relationship"
http://terminology.hl7.org/CodeSystem/v2-0092,2.0.0,active,"2.16.840.1.113883.18.36",ReAdmissionIndicator,re-admissionIndicator,"Code system of concepts which are used to specify that a patient is being re admitted to a healthcare facilityin from which they were discharged, and indicates the circumstances around such re-admission.  Used in HL7 Version 2.x messagine in the PV1 segment.","ValueSet/v2-0092"
http://terminology.hl7.org/CodeSystem/v2-0116,2.0.0,active,"2.16.840.1.113883.18.47",BedStatus,bedStatus,"Code system of concepts which specify the state of a bed in an inpatient setting, and is used to determine if a patient may be assigned to it or not.  Used in HL7 Version 2.x messaging in the DLD and PV1 segments.","ValueSet/v2-0116"
http://terminology.hl7.org/CodeSystem/v2-0131,2.0.0,active,"2.16.840.1.113883.18.58",ContactRole2,contactRole2,"Code system of concepts which specify a relationship role that the next of kin/associated parties plays with regard to the patient. Also used in referrals, for example, it may be necessary to identify the contact representative at the clinic that sent a referral. Used in HL7 Version 2 messaging in the NK1 and CTD segments after 2.5, when it replace 2.16.840.1.113883.18.57.","ValueSet/relatedperson-relationshiptype,ValueSet/patient-contactrelationship"
http://terminology.hl7.org/CodeSystem/v2-0203,4.0.0,active,"2.16.840.1.113883.18.108",IdentifierType,identifierType,"HL7-defined code system of concepts specifying type of identifier. Used in HL7 Version 2.x messaging data types CX, PLN, PPN, XCN and XON.","ValueSet/identifier-type"
http://terminology.hl7.org/CodeSystem/v2-0443,2.0.0,active,"2.16.840.1.113883.18.283",ProviderRole,providerRole,"Code system of concepts specifying the functional involvement with the activity being transmitted (e.g., Case Manager, Evaluator, Transcriber, Nurse Care Practitioner, Midwife, Physician Assistant, etc.).  Used in HL7 Version 2.x messaging in the ROL segment.","ValueSet/immunization-function"
http://terminology.hl7.org/CodeSystem/v3-ActCode,9.0.0,active,"2.16.840.1.113883.5.4",ActCode,ActCode,"A code specifying the particular kind of Act that the Act-instance represents within its class.    *Constraints:* The kind of Act (e.g. physical examination, serum potassium, inpatient encounter, charge financial transaction, etc.) is specified with a code from one of several, typically external, coding systems. The coding system will depend on the class of Act, such as LOINC for observations, etc.    Conceptually, the Act.code must be a specialization of the Act.classCode. This is why the structure of ActClass domain should be reflected in the superstructure of the ActCode domain and then individual codes or externally referenced vocabularies subordinated under these domains that reflect the ActClass structure.    Act.classCode and Act.code are not modifiers of each other but the Act.code concept should really imply the Act.classCode concept. For a negative example, it is not appropriate to use an Act.code ""potassium"" together with and Act.classCode for ""laboratory observation"" to somehow mean ""potassium laboratory observation"" and then use the same Act.code for ""potassium"" together with Act.classCode for ""medication"" to mean ""substitution of potassium"". This mutually modifying use of Act.code and Act.classCode is not permitted.","ValueSet/v3-ActPharmacySupplyType,ValueSet/v3-ActIncidentCode,ValueSet/v3-ActCode,ValueSet/v3-ActEncounterCode"
http://terminology.hl7.org/CodeSystem/v3-ActReason,3.1.0,active,"2.16.840.1.113883.5.8",ActReason,ActReason,"A set of codes specifying the motivation, cause, or rationale of an Act, when such rationale is not reasonably represented as an ActRelationship of type ""has reason"" linking to another Act.    *Examples:* Example reasons that might qualify for being coded in this field might be: ""routine requirement"", ""infectious disease reporting requirement"", ""on patient request"", ""required by law"".","ValueSet/v3-PurposeOfUse,ValueSet/immunization-status-reason,ValueSet/v3-SubstanceAdminSubstitutionReason"
http://terminology.hl7.org/CodeSystem/v3-ActSite,3.0.0,active,"2.16.840.1.113883.5.1052",ActSite,ActSite,"An anatomical location on an organism which can be the focus of an act.","ValueSet/immunization-site"
http://terminology.hl7.org/CodeSystem/v3-Confidentiality,3.0.0,active,"2.16.840.1.113883.5.25",Confidentiality,Confidentiality,"A set of codes specifying the security classification of acts and roles in accordance with the definition for concept domain ""Confidentiality"".","ValueSet/v3-ConfidentialityClassification"
http://terminology.hl7.org/CodeSystem/v3-EncounterSpecialCourtesy,3.0.0,active,"2.16.840.1.113883.5.40",EncounterSpecialCourtesy,EncounterSpecialCourtesy,"**** MISSING DESCRIPTION ****","ValueSet/encounter-special-courtesy"
http://terminology.hl7.org/CodeSystem/v3-NullFlavor,3.0.0,active,"2.16.840.1.113883.5.1008",NullFlavor,NullFlavor,"A collection of codes specifying why a valid value is not present.","ValueSet/encounter-special-courtesy"
http://terminology.hl7.org/CodeSystem/v3-ParticipationFunction,3.0.0,active,"2.16.840.1.113883.5.88",ParticipationFunction,ParticipationFunction,"This code is used to specify the exact function an actor had in a service in all necessary detail. This domain may include local extensions (CWE).","ValueSet/security-role-type,ValueSet/ch-core-encounter-participation-type"
http://terminology.hl7.org/CodeSystem/v3-ParticipationType,5.0.0,active,"2.16.840.1.113883.5.90",ParticipationType,ParticipationType,"A code specifying the meaning and purpose of every Participation instance. Each of its values implies specific constraints on the Roles undertaking the participation.","ValueSet/security-role-type"
