URL,Version,Status,OIDs,Name,Title,Description,Used
http://terminology.hl7.org/CodeSystem/v3-RoleClass,4.0.0,active,"2.16.840.1.113883.5.110",RoleClass,RoleClass,"Codes for the Role class hierarchy. The values in this hierarchy, represent a Role which is an association or relationship between two entities - the entity that plays the role and the entity that scopes the role. Roles names are derived from the name of the playing entity in that role.    The role hierarchy stems from three core concepts, or abstract domains:     *  **RoleClassOntological** is an abstract domain that collects roles in which the playing entity is defined or specified by the scoping entity.   *  **RoleClassPartitive** collects roles in which the playing entity is in some sense a ""part"" of the scoping entity.   *  **RoleClassAssociative** collects all of the remaining forms of association between the playing entity and the scoping entity. This set of roles is further partitioned between:             *  **RoleClassPassive** which are roles in which the playing entity is used, known, treated, handled, built, or destroyed, etc. under the auspices of the scoping entity. The playing entity is passive in these roles in that the role exists without an agreement from the playing entity.       *  **RoleClassMutualRelationship** which are relationships based on mutual behavior of the two entities. The basis of these relationship may be formal agreements or they may be *de facto* behavior. Thus, this sub-domain is further divided into:                     *  **RoleClassRelationshipFormal** in which the relationship is formally defined, frequently by a contract or agreement.           *  **Personal relationship** which inks two people in a personal relationship.    The hierarchy discussed above is represented In the current vocabulary tables as a set of abstract domains, with the exception of the ""Personal relationship"" which is a leaf concept.    *OpenIssue:* Description copied from Concept Domain of same name. Must be verified.","ValueSet/security-role-type"
http://terminology.hl7.org/CodeSystem/v3-RoleCode,3.0.0,active,"2.16.840.1.113883.5.111",RoleCode,RoleCode,"A set of codes further specifying the kind of Role; specific classification codes for further qualifying RoleClass codes.","ValueSet/security-role-type,ValueSet/relatedperson-relationshiptype,ValueSet/v3-ServiceDeliveryLocationRoleType"
http://terminology.hl7.org/CodeSystem/v3-substanceAdminSubstitution,3.0.0,active,"2.16.840.1.113883.5.1070",SubstanceAdminSubstitution,Substance Admin Substitution,"Identifies what sort of change is permitted or has occurred between the therapy that was ordered and the therapy that was/will be provided.","ValueSet/ActSubstanceAdminSubstitutionCode,ValueSet/v3-ActSubstanceAdminSubstitutionCode"
http://terminology.hl7.org/fhir/CodeSystem/medicationdispense-category,4.0.1,draft,"2.16.840.1.113883.4.642.4.1315",MedicationDispense Category Codes,Medication dispense  category  codes,"MedicationDispense Category Codes","ValueSet/medicationdispense-category"
http://terminology.hl7.org/fhir/CodeSystem/medicationdispense-status-reason,4.0.1,draft,"2.16.840.1.113883.4.642.4.1317",MedicationDispense Status Reason Codes,Medication dispense  status  reason  codes,"MedicationDispense Status Codes","ValueSet/medicationdispense-status-reason"
http://unitsofmeasure.org,3.0.1,active,"2.16.840.1.113883.6.8",UCUM,Unified Code for Units of Measure (UCUM),"The Unified Code for Units of Measure (UCUM) is a code system intended to include all units of measures being contemporarily used in international science, engineering, and business. The purpose is to facilitate unambiguous electronic communication of quantities together with their units. The focus is on electronic communication, as opposed to communication between humans. A typical application of The Unified Code for Units of Measure are electronic data interchange (EDI) protocols, but there is nothing that prevents it from being used in other types of machine communication.","ValueSet/UnitCode"
urn:ietf:bcp:47,2.0.1,active,"2.16.840.1.113883.6.121",Ietf3066,Tags for the Identification of Languages,"Older value from OID registry.  Superceded; see recommendations in BCP-47.","ValueSet/DocumentEntry.languageCode,ValueSet/languages"
urn:oid:0.4.0.127.0.16.1.1.2.1,3.2.0,active,"0.4.0.127.0.16.1.1.2.1",EdqmStandardTerms,EDQM - Standard Terms,"EDQM - Standard Terms used in Switzerland (aggregations of codes of ValueSets Route of Administration, Dose Form and Administration Method, see original codes system defined in https://standardterms.edqm.eu/#)","ValueSet/edqm-administrationmethod,ValueSet/edqm-routeofadministration,ValueSet/edqm-pharmaceuticaldoseform"
urn:oid:2.16.756.5.30.1.127.3.10.10,3.2.0,active,"2.16.756.5.30.1.127.3.10.10",ChEhealthCodesystemFormat,ch-ehealth-codesystem-format,"Document format as per Annex; EPRO-FDHA.         This unambiguous code defines the format of the XDS document. Together with the mimetype, this should provide the potential consumer with sufficient information as to whether they are in a position to process the document.","ValueSet/DocumentEntry.formatCode"
urn:oid:2.16.756.5.30.1.127.3.10.12,3.2.0,active,"2.16.756.5.30.1.127.3.10.12",ChEhealthCodesystemLanguage,ch-ehealth-codesystem-language,"Document language as per Annex 3 EPRO-FDHA. Defines the language in which the document was written.","ValueSet/DocumentEntry.languageCode"
urn:oid:2.16.756.5.30.1.127.3.10.9,3.2.0,active,"2.16.756.5.30.1.127.3.10.9",ChEhealthCodesystemHpd,ch-ehealth-codesystem-hpd,"HCProfessional.hcProfession","ValueSet/HCProfessional.hcProfession"
urn:oid:2.16.756.5.30.1.127.3.5,3.2.0,active,"2.16.756.5.30.1.127.3.5",ChEhealthCodesystemMedreg,ch-ehealth-codesystem-medreg,"HCProfessional.hcSpecialisation","ValueSet/HCProfessional.hcSpecialisation"
