URL,Version,Status,OIDs,Name,Title,Description,Used
http://fhir.ch/ig/ch-emed-epr/CodeSystem/ch-emed-epr-paper-format-code-system,3.0.0,draft,,CHEMEDEPRPaperFormatCS,CH EMED EPR Paper Format Code System,"Possible paper formats that can be delivered by a CH EMED EPR service rendering original representations.","ValueSet/ch-emed-epr-paper-format"
http://hl7.org/fhir/event-timing,4.0.1,active,"2.16.840.1.113883.4.642.4.76",EventTiming,EventTiming,"Real world event relating to the schedule.","ValueSet/ch-emed-epr-event-timing"
http://snomed.info/sct,null,active,"2.16.840.1.113883.6.96",SNOMED_CT,SNOMED CT (all versions),"SNOMED CT is the most comprehensive and precise clinical health terminology product in the world, owned and distributed around the world by The International Health Terminology Standards Development Organisation (IHTSDO).","ConceptMap/CHEMEDEPRAmountQuantityUnitCodeToCdTyp9,ValueSet/ch-emed-epr-amount-quantity-unit-code,ConceptMap/CdTyp9ToCHEMEDEPRAmountQuantityUnitCode,ValueSet/HCProfessional.hcProfession"
http://terminology.hl7.org/CodeSystem/v3-substanceAdminSubstitution,3.0.0,active,"2.16.840.1.113883.5.1070",SubstanceAdminSubstitution,Substance Admin Substitution,"Identifies what sort of change is permitted or has occurred between the therapy that was ordered and the therapy that was/will be provided.","ValueSet/ch-emed-epr-substance-admin-substitution-code"
http://unitsofmeasure.org,3.0.1,active,"2.16.840.1.113883.6.8",UCUM,Unified Code for Units of Measure (UCUM),"The Unified Code for Units of Measure (UCUM) is a code system intended to include all units of measures being contemporarily used in international science, engineering, and business. The purpose is to facilitate unambiguous electronic communication of quantities together with their units. The focus is on electronic communication, as opposed to communication between humans. A typical application of The Unified Code for Units of Measure are electronic data interchange (EDI) protocols, but there is nothing that prevents it from being used in other types of machine communication.","ConceptMap/CHEMEDEPRAmountQuantityUnitCodeToCdTyp9,ValueSet/ch-emed-epr-time-quantity-unit-code,ValueSet/ch-emed-epr-amount-quantity-unit-code,ConceptMap/CHEMEDEPRTimeQuantityUnitCodeToCdTyp9,ConceptMap/CdTyp9ToCHEMEDEPRTimeQuantityUnitCode,ConceptMap/CdTyp9ToCHEMEDEPRAmountQuantityUnitCode"
urn:oid:0.4.0.127.0.16.1.1.2.1,3.3.0,active,"0.4.0.127.0.16.1.1.2.1",EdqmStandardTerms,EDQM - Standard Terms,"EDQM - Standard Terms used in Switzerland (aggregations of codes of ValueSets Route of Administration, Dose Form and Administration Method, see original codes system defined in https://standardterms.edqm.eu/#)","ConceptMap/RouteOfAdministrationEDQMToCdTyp26,ValueSet/edqm-routeofadministration,ConceptMap/CdTyp26ToRouteOfAdministrationEDQM,ValueSet/ch-emed-epr-route-of-administration"
urn:oid:2.16.756.5.30.1.127.3.10.9,3.3.0,active,"2.16.756.5.30.1.127.3.10.9",ChEhealthCodesystemHpd,ch-ehealth-codesystem-hpd,"HCProfessional.hcProfession","ValueSet/HCProfessional.hcProfession"
