"Id","Path","Slice Name","Alias(s)","Label","Min","Max","Must Support?","Is Modifier?","Is Summary?","Type(s)","Short","Definition","Comments","Requirements","Default Value","Meaning When Missing","Fixed Value","Pattern","Example","Minimum Value","Maximum Value","Maximum Length","Binding Strength","Binding Description","Binding Value Set","Code","Slicing Discriminator","Slicing Description","Slicing Ordered","Slicing Rules","Base Path","Base Min","Base Max","Condition(s)","Constraint(s)","Mapping: HL7 v2 Mapping","Mapping: RIM Mapping"
"Range","Range","","","",0,*,"","","","null {[]} {[]}
","Set of values bounded by low and high","A set of ordered Quantities defined by a low and high limit.","The stated low and high value are assumed to have arbitrarily high precision when it comes to determining which values are in the range. I.e. 1.99 is not in the range 2 -> 3.","","","","","","","","",,,,,"",,,,"Range",0,*,"ele-1
","ele-1:All FHIR elements must have a @value or children {hasValue() or (children().count() > id.count())}
rng-2:If present, low SHALL have a lower value than high {low.empty() or high.empty() or (low <= high)}","NR and also possibly SN (but see also quantity)","n/a","IVL<QTY[not(type=""TS"")]> [lowClosed=""true"" and highClosed=""true""]or URG<QTY[not(type=""TS"")]>"
"Range.id","Range.id","","","",0,1,"","","","string {[]} {[]}
","✕ This element is not supported","Implementers should not set or read this element. 
This element is only kept as optional to allow submission of documents that would contain a value, 
since those documents are still readable by others.
The meaning of this element is undefined in this profile.","","","","","","","","","",,,,,"",,,,"Element.id",0,1,"","","n/a"
"Range.extension","Range.extension","","","",0,*,"","","","Extension {[]} {[]}
","✕ This element is not supported","Implementers should not set or read this element. 
This element is only kept as optional to allow submission of documents that would contain a value, 
since those documents are still readable by others.
The meaning of this element is undefined in this profile.","","","","","","","","","",,,,,"","value:url}
","Extensions are always sliced by (at least) url",,"open","Element.extension",0,*,"","ele-1:All FHIR elements must have a @value or children {hasValue() or (children().count() > id.count())}
ext-1:Must have either extensions or value[x], not both {extension.exists() != value.exists()}"
"Range.low","Range.low","","","",1,1,"","","","Quantity {[CanonicalType[http://fhir.ch/ig/ch-emed-epr/StructureDefinition/ch-emed-epr-amount-quantity]]} {[]}
","A fixed quantity (no comparator)","The comparator is not used on a SimpleQuantity","The context of use may frequently define what kind of quantity this is and therefore what kind of units can be used. The context of use may also restrict the values for the comparator.","","","","","","","","",,,,,"",,,,"Range.low",0,1,"ele-1
","ele-1:All FHIR elements must have a @value or children {hasValue() or (children().count() > id.count())}
qty-3:If a code for the unit is present, the system SHALL also be present {code.empty() or system.exists()}sqty-1:The comparator is not used on a SimpleQuantity {comparator.empty()}","SN (see also Range) or CQ","n/a","PQ, IVL<PQ>, MO, CO, depending on the values"
"Range.high","Range.high","","","",1,1,"","","","Quantity {[CanonicalType[http://fhir.ch/ig/ch-emed-epr/StructureDefinition/ch-emed-epr-amount-quantity]]} {[]}
","A fixed quantity (no comparator)","The comparator is not used on a SimpleQuantity","The context of use may frequently define what kind of quantity this is and therefore what kind of units can be used. The context of use may also restrict the values for the comparator.","","","","","","","","",,,,,"",,,,"Range.high",0,1,"ele-1
","ele-1:All FHIR elements must have a @value or children {hasValue() or (children().count() > id.count())}
qty-3:If a code for the unit is present, the system SHALL also be present {code.empty() or system.exists()}sqty-1:The comparator is not used on a SimpleQuantity {comparator.empty()}","SN (see also Range) or CQ","n/a","PQ, IVL<PQ>, MO, CO, depending on the values"
